check,required,ok,evidence,next_action
next_trial_selected,True,True,trial_id=controlled-public-chrome-downlink-noheartbeat-network-change-001,-
next_trial_is_p0_baseline,True,False,trial_id=controlled-public-chrome-downlink-noheartbeat-network-change-001,do not use this guard for non-P0 trials
baseline_config_ready,True,True,config_exists=True; baseline_config_ready=True,fill harness/config/controlled-public-origin.env and rerun check_controlled_public_config.py
needed_now_gates_cleared,True,False,needed_now=baseline_summary_ready;network_change_command_present,clear all needed-now gates in p0-unblock-status
next_trial_ready,True,False,missing_required=baseline_summary_ready;network_change_command_present;desktop_path_change_ready,run check_next_final_handover_trial_readiness.py and fix missing gates
disk_ready,True,True,disk_ready=yes,free disk before heavy NetLog/qlog capture
chrome_ready,True,True,chrome_ready=yes,install or configure Chrome binary
